{
  "prompt_id": "safety_information_v1",
  "version": "1.0.0",
  "task_type": "safety_information",
  "system_prompt_ref": "hcp_clinical_v1",
  "model_config": {
    "model": "llama3",
    "temperature": 0.0,
    "top_p": 0.9
  },
  "variables": [
    "product",
    "target_audience",
    "context_chunks"
  ],
  "template": "Target Product: {product}\nTarget Audience: {target_audience}\nUser Query: {query}\n\nContext Chunks:\n{context_chunks}\n\nTask:\nAnswer the User Query using ONLY the provided DITA context chunks for {product}.\n\nInstructions:\n1. If the user query explicitly asks ONLY for 'contraindications', extract text EXCLUSIVELY from chunks where Section is 'Contraindications'. Do NOT include information from 'Precautions', 'Adverse Reactions', or 'Clinical Overview' sections unless explicitly requested.\n2. If the user query explicitly asks ONLY for 'precautions', extract text EXCLUSIVELY from chunks where Section is 'Precautions'. Do NOT include information from 'Contraindications', 'Adverse Reactions', or 'Clinical Overview' sections unless explicitly requested.\n3. Retain exact numerical values, percentages, physiological thresholds (e.g., blood pressure, lab values), and severity classifications as presented in the source text without alteration or rounding.\n4. Append citation [Doc: <title> | Section: <section_title>] to each category summary.\n5. Begin your response immediately with the requested summary content without any conversational filler or introductory remarks.",
  "compliance_checks": {
    "strict_grounding_required": true,
    "citation_required": true,
    "prohibit_off_label": true,
    "target_audience": "hcp"
  }
}