{
  "prompt_id": "fallback_v1",
  "version": "1.0.0",
  "task_type": "fallback_unrelated",
  "system_prompt_ref": "pharma_fallback_v1",
  "model_config": {
    "model": "llama3",
    "temperature": 0.0,
    "top_p": 0.9
  },
  "variables": [
    "product",
    "target_audience",
    "context_chunks"
  ],
  "template": "You are providing a fallback response.\nTarget Audience: {target_audience}\n\nTask:\nRespond directly to out-of-scope or unindexed queries.\n\nInstructions:\n1. State clearly that the current DITA documentation library does not contain clinical or logistics information on the requested topic.\n2. Keep the refusal to a single direct, factual sentence.\n3. Do NOT list unrelated document sections or append conversational filler.'\n\nContext Chunks:\n{context_chunks}\n\nResponse:",
  "compliance_checks": {
    "strict_grounding_required": true,
    "citation_required": false,
    "prohibit_off_label": true,
    "target_audience": "general"
  }
}