{
  "prompt_id": "clinical_overview_v1",
  "version": "1.0.0",
  "task_type": "clinical_overview",
  "system_prompt_ref": "pharma_rag_default_v1",
  "model_config": {
    "model": "llama3",
    "temperature": 0.0,
    "top_p": 0.9
  },
  "variables": [
    "product",
    "target_audience",
    "context_chunks"
  ],
  "template": "Target Product: {product}\nTarget Audience: {target_audience}\nUser Query: {query}\n\nContext Chunks:\n{context_chunks}\n\nTask:\nAnswer the User Query using ONLY the provided DITA context chunks for {product}.\n\nInstructions:\n1. If the user query explicitly asks ONLY for 'mechanism of action', extract text EXCLUSIVELY from chunks where Section is 'Mechanism of Action'. Do NOT include information from 'Product Description' section unless explicitly requested.\n2. If the user query explicitly asks ONLY for 'product description', 'clinical overview', or 'product overview' of {product}, extract text EXCLUSIVELY from 'Clinical Overview'.\n3. Do NOT include 'Safety Information', 'Dosage Administration', and 'Adverse Reactions' sections in the response.\n4. Append citation [Doc: <title> | Section: <section_title>] to each category summary.\n\nResponse:",
  "compliance_checks": {
    "strict_grounding_required": true,
    "citation_required": true,
    "prohibit_off_label": true,
    "target_audience": "hcp"
  }
}