{
  "prompt_id": "adverse_reactions_v1",
  "version": "1.1.0",
  "task_type": "adverse_reactions",
  "system_prompt_ref": "hcp_clinical_v1",
  "model_config": {
    "model": "llama3",
    "temperature": 0.0,
    "top_p": 0.9
  },
  "variables": [
    "product",
    "target_audience",
    "context_chunks"
  ],
  "template": "Target Product: {product}\nTarget Audience: {target_audience}\nUser Query: {query}\n\nContext Chunks:\n{context_chunks}\n\nTask:\nAnswer the User Query using ONLY the provided DITA context chunks for {product}.\n\nInstructions:\n1. Match the exact section in the context chunks that corresponds to the User Query (e.g., if asked for serious adverse reactions, extract exclusively from sections titled 'Serious Adverse Reactions').\n2. Extract all clinical findings, percentages, and guidelines listed under that specific section.\n3. Do NOT reclassify common adverse reactions as serious, and do NOT include contraindications or precautions.\n4. Append citation [Doc: <title> | Section: <section_title>] to each category summary.\n5. Begin your response immediately with the requested summary content without any conversational filler or introductory remarks.",
  "compliance_checks": {
    "strict_grounding_required": true,
    "citation_required": true,
    "prohibit_off_label": true,
    "target_audience": "hcp"
  }
}