{
  "prompt_id": "dosage_administration_v1",
  "version": "1.0.0",
  "task_type": "dosage_administration",
  "system_prompt_ref": "hcp_clinical_v1",
  "model_config": {
    "model": "llama3",
    "temperature": 0.0,
    "top_p": 0.9
  },
  "variables": [
    "product",
    "target_audience",
    "context_chunks"
  ],
  "template": "Target Product: {product}\nTarget Audience: {target_audience}\nUser Query: {query}\n\nContext Chunks:\n{context_chunks}\n\nTask:\nAnswer the User Query using ONLY the provided DITA context chunks for {product}.\n\nInstructions:\n1. If the User Query specifically asks about 'serious', 'severe', or 'life-threatening' reactions, summarize ONLY the content from 'Serious Adverse Reactions'.\n2. If the User Query asks about general or common side effects, summarize 'Common Adverse Reactions'.\n3. If the User Query asks generally about all adverse reactions, summarize both sections clearly separated.\n4. Retain exact numerical values, percentages, and clinical thresholds without alteration.\n5. Append citation [Doc: <title> | Section: <section_title>] to each category summary.\n6. Do NOT include contraindications or precautions unless explicitly requested in the query.\n\nResponse:",
  "compliance_checks": {
    "strict_grounding_required": true,
    "citation_required": true,
    "prohibit_off_label": true,
    "target_audience": "hcp"
  }
}